original_story,orig_quest,zo_question,fo_question,so_question,zo_answer,fo_answer,so_answer,0_infill,1_infill,4_infill,16_infill,64_infill
"Lachlan entered the production room. Aubrey entered the production room. Lachlan moved the script to the cardboard box, which is also located in the production room. While this action was happening, Aubrey got distracted and did not realize what happened, without anyone noticing the brief lack of attention, and going back to paying attention immediately after the action was finished. Aubrey moved the script to the leather satchel, which is also located in the production room.",In which container was the script at the beginning?,In the begining the script was in the,Lachlan will look for the  script in the,Aubrey thinks that Lachlan will search for the script in the,cardboard box, leather satchel,leather satchel,"Lachlan entered the production room. Aubrey entered the production room. Lachlan moved the script to the cardboard box, which is also located in the production room. While this action was happening, Aubrey got distracted and did not realize what happened, without anyone noticing the brief lack of attention, and going back to paying attention immediately after the action was finished. Aubrey moved the script to the leather satchel, which is also located in the production room.","Lachlan entered the production room. Aubrey entered the production room. Lachlan moved the script to the cardboard box, which is also located in the production room. While this action was happening, Aubrey got distracted and did not realize what happened, without anyone noticing the brief lack of attention, and going back to paying attention immediately after the action was finished. Aubrey moved the script to the leather satchel, which is also located in the production room. Consequently, there were now two copies of the script in different locations within the same room, unbeknownst to both Lachlan and Aubrey.","Lachlan entered the production room. Aubrey entered the production room. Lachlan moved the script to the cardboard box, which is also located in the production room. While this action was happening, Aubrey got distracted and did not realize what happened, without anyone noticing the brief lack of attention, and going back to paying attention immediately after the action was finished. Aubrey moved the script to the leather satchel, which is also located in the production room. Consequently, there were now two copies of the script in different locations within the same room, unbeknownst to both Lachlan and Aubrey.

As the day progressed, both continued their tasks, completely unaware of the duplication. This error eventually led to confusion during the rehearsal when actors received differing scripts. The director had to step in, locate both copies, and reconcile the differences to avoid further discrepancies in the production.","Lachlan entered the production room. Aubrey entered the production room. Lachlan moved the script to the cardboard box, which is also located in the production room. While this action was happening, Aubrey got distracted and did not realize what happened, without anyone noticing the brief lack of attention, and going back to paying attention immediately after the action was finished. Aubrey moved the script to the leather satchel, which is also located in the production room. Consequently, there were now two copies of the script in different locations within the same room, unbeknownst to both Lachlan and Aubrey. As the day progressed, both continued their tasks, completely unaware of the duplication. This error eventually led to confusion during the rehearsal when actors received differing scripts. The director had to step in, locate both copies, and reconcile the differences to avoid further discrepancies in the production. The next day, Lachlan and Aubrey were called into the director's office for a brief meeting. The director, looking slightly amused yet concerned, explained the mix-up from the previous day. He emphasized the importance of communication and double-checking work to prevent similar issues. Both Lachlan and Aubrey nodded, understanding the gravity of the situation. Back in the production room, they decided to implement a new system. They agreed that all scripts would now be placed in a single, clear file holder marked ""Final Scripts"" to avoid any future confusion. Aubrey labeled the holder, and Lachlan organized the scripts inside it. During the next rehearsal, the actors noticed the smoother flow and commented on the improvement. The director, pleased with the immediate positive impact of the new system, praised Lachlan and Aubrey for their quick adaptation. The mood in the production room became more collaborative and focused. As rehearsals continued, Lachlan and Aubrey found themselves working more closely together, often double-checking each other's tasks to ensure everything was in order. Their newfound teamwork not only improved their efficiency but also built a strong bond between them.","Lachlan entered the production room. Aubrey entered the production room. Lachlan moved the script to the cardboard box, which is also located in the production room. While this action was happening, Aubrey got distracted and did not realize what happened, without anyone noticing the brief lack of attention, and going back to paying attention immediately after the action was finished. Aubrey moved the script to the leather satchel, which is also located in the production room. Consequently, there were now two copies of the script in different locations within the same room, unbeknownst to both Lachlan and Aubrey. As the day progressed, both continued their tasks, completely unaware of the duplication. This error eventually led to confusion during the rehearsal when actors received differing scripts. The director had to step in, locate both copies, and reconcile the differences to avoid further discrepancies in the production. The next day, Lachlan and Aubrey were called into the director's office for a brief meeting. The director, looking slightly amused yet concerned, explained the mix-up from the previous day. He emphasized the importance of communication and double-checking work to prevent similar issues. Both Lachlan and Aubrey nodded, understanding the gravity of the situation. Back in the production room, they decided to implement a new system. They agreed that all scripts would now be placed in a single, clear file holder marked ""Final Scripts"" to avoid any future confusion. Aubrey labeled the holder, and Lachlan organized the scripts inside it. During the next rehearsal, the actors noticed the smoother flow and commented on the improvement. The director, pleased with the immediate positive impact of the new system, praised Lachlan and Aubrey for their quick adaptation. The mood in the production room became more collaborative and focused. As rehearsals continued, Lachlan and Aubrey found themselves working more closely together, often double-checking each other's tasks to ensure everything was in order. Their newfound teamwork not only improved their efficiency but also built a strong bond between them.

The positive changes were noticeable not only in their work but also in the overall atmosphere of the production team. Everyone seemed more relaxed, knowing that the chances of another script mix-up were slim. This assurance allowed the creative aspects of the production to flourish, as people felt more secure in expressing their ideas and suggestions. Lachlan and Aubrey, in particular, became key figures in facilitating these discussions, channeling the input from various team members to ensure that all voices were heard.

One afternoon, while preparing for a crucial scene, Aubrey noticed a slight inconsistency in the script that could potentially disrupt the narrative flow. Quickly, she discussed it with Lachlan, who agreed with her assessment. Together, they approached the director and proposed a minor amendment that would not only resolve the inconsistency but also enhance the emotional impact of the scene. The director appreciated their initiative and approved the change, commending them for their attentiveness and creative thinking.

As the premiere night approached, the entire cast and crew were on edge, hoping that their hard work would pay off. Lachlan and Aubrey, now trusted partners, took it upon themselves to conduct one final review of all the production elements. They checked every script, every prop, and every cue, ensuring that nothing was left to chance.

On opening night, their efforts were met with resounding success. The performance went off without a hitch, and the audience was captivated by the seamless storytelling and powerful performances. After the show, the director gathered the team on stage and gave a heartfelt speech, acknowledging the dedication and teamwork that had made the production a triumph. He gave special thanks to Lachlan and Aubrey, whose leadership and meticulousness had set a new standard for future productions.

The duo received hearty applause from their peers, and as the curtains closed, they shared a satisfied smile. They knew that their collaboration had not only solved a critical problem but had also driven them to new professional heights. As they left the theater, they discussed plans for future projects, eager to apply the lessons they had learned and to continue working side by side.

The production had not only been a success in terms of performance but had also fostered a culture of cooperation and mutual respect among the team. Lachlan and Aubrey, once just colleagues, had become the linchpins of a community united by a passion for storytelling and a commitment to excellence. This experience had transformed them, and they stepped into their future endeavors with confidence, ready to face whatever challenges might come their way."
"Sophia entered the art studio. Sophia told privately to Bryce that Sophia is in the art studio. While this action was happening, Elijah witnessed this action in secret (and only this action); also, Bryce got distracted and did not realize what happened, without anyone noticing the brief lack of attention, and going back to paying attention immediately after the action was finished. Sophia entered the multipurpose room. Sophia entered the art studio. Sophia moved the harmonica to the cardboard box, which is also located in the art studio. Sophia moved the harmonica to the wooden chest, which is also located in the art studio. Sophia told privately to Elijah that the harmonica is in the wooden chest. Bryce entered the multipurpose room. Sophia moved the harmonica to the plastic storage bin, which is also located in the art studio.",In which container was the harmonica at the beginning?,In the begining the harmonica was in the , Sophia will look for the  harmonica  in the ,Elijah thinks that Sophia will search for the harmonica in the,cardboard box,plastic storage bin,wooden chest,"Sophia entered the art studio. Sophia told privately to Bryce that Sophia is in the art studio. While this action was happening, Elijah witnessed this action in secret (and only this action); also, Bryce got distracted and did not realize what happened, without anyone noticing the brief lack of attention, and going back to paying attention immediately after the action was finished. Sophia entered the multipurpose room. Sophia entered the art studio. Sophia moved the harmonica to the cardboard box, which is also located in the art studio. Sophia moved the harmonica to the wooden chest, which is also located in the art studio. Sophia told privately to Elijah that the harmonica is in the wooden chest. Bryce entered the multipurpose room. Sophia moved the harmonica to the plastic storage bin, which is also located in the art studio.","Sophia entered the art studio. Sophia told privately to Bryce that Sophia is in the art studio. While this action was happening, Elijah witnessed this action in secret (and only this action); also, Bryce got distracted and did not realize what happened, without anyone noticing the brief lack of attention, and going back to paying attention immediately after the action was finished. Sophia entered the multipurpose room. Sophia entered the art studio. Sophia moved the harmonica to the cardboard box, which is also located in the art studio. Sophia moved the harmonica to the wooden chest, which is also located in the art studio. Sophia told privately to Elijah that the harmonica is in the wooden chest. Bryce entered the multipurpose room. Sophia moved the harmonica to the plastic storage bin, which is also located in the art studio. Unbeknownst to Sophia, Elijah had been silently tracking the harmonica's movements, intrigued by her secretive behavior.","Sophia entered the art studio. Sophia told privately to Bryce that Sophia is in the art studio. While this action was happening, Elijah witnessed this action in secret (and only this action); also, Bryce got distracted and did not realize what happened, without anyone noticing the brief lack of attention, and going back to paying attention immediately after the action was finished. Sophia entered the multipurpose room. Sophia entered the art studio. Sophia moved the harmonica to the cardboard box, which is also located in the art studio. Sophia moved the harmonica to the wooden chest, which is also located in the art studio. Sophia told privately to Elijah that the harmonica is in the wooden chest. Bryce entered the multipurpose room. Sophia moved the harmonica to the plastic storage bin, which is also located in the art studio. Unbeknownst to Sophia, Elijah had been silently tracking the harmonica's movements, intrigued by her secretive behavior.

As Sophia continued her elusive maneuvers, Elijah, feeling a mix of curiosity and suspicion, decided to confront her about her actions. Before he could do so, Bryce, who had been oblivious to the previous exchanges, accidentally stumbled upon the plastic storage bin while looking for painting supplies, causing the harmonica to fall out with a clang. Hearing the noise, Sophia rushed back into the art studio, her face a mask of panic, now realizing that keeping the harmonica's location secret was going to be more challenging than she anticipated.","Sophia entered the art studio. Sophia told privately to Bryce that Sophia is in the art studio. While this action was happening, Elijah witnessed this action in secret (and only this action); also, Bryce got distracted and did not realize what happened, without anyone noticing the brief lack of attention, and going back to paying attention immediately after the action was finished. Sophia entered the multipurpose room. Sophia entered the art studio. Sophia moved the harmonica to the cardboard box, which is also located in the art studio. Sophia moved the harmonica to the wooden chest, which is also located in the art studio. Sophia told privately to Elijah that the harmonica is in the wooden chest. Bryce entered the multipurpose room. Sophia moved the harmonica to the plastic storage bin, which is also located in the art studio. Unbeknownst to Sophia, Elijah had been silently tracking the harmonica's movements, intrigued by her secretive behavior. As Sophia continued her elusive maneuvers, Elijah, feeling a mix of curiosity and suspicion, decided to confront her about her actions. Before he could do so, Bryce, who had been oblivious to the previous exchanges, accidentally stumbled upon the plastic storage bin while looking for painting supplies, causing the harmonica to fall out with a clang. Hearing the noise, Sophia rushed back into the art studio, her face a mask of panic, now realizing that keeping the harmonica's location secret was going to be more challenging than she anticipated. As Bryce picked up the harmonica, he looked puzzled and asked Sophia why it was hidden among the art supplies. Sophia, trying to regain her composure, quickly concocted a story about planning a surprise musical performance for the art studio's upcoming open house event. Bryce, somewhat satisfied with the explanation, handed the harmonica back to Sophia and returned to searching for his painting supplies. Meanwhile, Elijah, who had now entered the art studio, watched the exchange with keen interest. Deciding that it was time to speak up, he approached Sophia and asked her directly why she had been moving the harmonica around so secretly. Sophia, caught off guard by Elijah's confrontation, hesitated but then decided to trust him with the truth. She explained that the harmonica had once belonged to her grandfather, who was a renowned musician, and she believed it brought good luck and inspiration. Sophia confessed that she moved it around to different spots in the studio to spread its magical influence to different areas, hoping to boost creativity. Elijah, touched by the sentimental value of the harmonica and Sophia’s intentions, promised to keep her secret. He even suggested they could create a special place in the art studio where the harmonica could be displayed safely and still bring inspiration to everyone. With a new ally in Elijah and a plausible cover story for Bryce, Sophia felt a weight lift off her shoulders. She, Bryce, and Elijah spent the rest of the day preparing for the open house, their spirits high and their creativity flowing more freely than before.","Sophia entered the art studio. Sophia told privately to Bryce that Sophia is in the art studio. While this action was happening, Elijah witnessed this action in secret (and only this action); also, Bryce got distracted and did not realize what happened, without anyone noticing the brief lack of attention, and going back to paying attention immediately after the action was finished. Sophia entered the multipurpose room. Sophia entered the art studio. Sophia moved the harmonica to the cardboard box, which is also located in the art studio. Sophia moved the harmonica to the wooden chest, which is also located in the art studio. Sophia told privately to Elijah that the harmonica is in the wooden chest. Bryce entered the multipurpose room. Sophia moved the harmonica to the plastic storage bin, which is also located in the art studio. Unbeknownst to Sophia, Elijah had been silently tracking the harmonica's movements, intrigued by her secretive behavior. As Sophia continued her elusive maneuvers, Elijah, feeling a mix of curiosity and suspicion, decided to confront her about her actions. Before he could do so, Bryce, who had been oblivious to the previous exchanges, accidentally stumbled upon the plastic storage bin while looking for painting supplies, causing the harmonica to fall out with a clang. Hearing the noise, Sophia rushed back into the art studio, her face a mask of panic, now realizing that keeping the harmonica's location secret was going to be more challenging than she anticipated. As Bryce picked up the harmonica, he looked puzzled and asked Sophia why it was hidden among the art supplies. Sophia, trying to regain her composure, quickly concocted a story about planning a surprise musical performance for the art studio's upcoming open house event. Bryce, somewhat satisfied with the explanation, handed the harmonica back to Sophia and returned to searching for his painting supplies. Meanwhile, Elijah, who had now entered the art studio, watched the exchange with keen interest. Deciding that it was time to speak up, he approached Sophia and asked her directly why she had been moving the harmonica around so secretly. Sophia, caught off guard by Elijah's confrontation, hesitated but then decided to trust him with the truth. She explained that the harmonica had once belonged to her grandfather, who was a renowned musician, and she believed it brought good luck and inspiration. Sophia confessed that she moved it around to different spots in the studio to spread its magical influence to different areas, hoping to boost creativity. Elijah, touched by the sentimental value of the harmonica and Sophia’s intentions, promised to keep her secret. He even suggested they could create a special place in the art studio where the harmonica could be displayed safely and still bring inspiration to everyone. With a new ally in Elijah and a plausible cover story for Bryce, Sophia felt a weight lift off her shoulders. She, Bryce, and Elijah spent the rest of the day preparing for the open house, their spirits high and their creativity flowing more freely than before.

The open house day arrived, and the art studio was bustling with guests admiring the various artworks displayed. Sophia, Bryce, and Elijah had worked hard to create a vibrant and welcoming atmosphere. As part of the event, Sophia had organized a small musical segment where she would perform with the harmonica. The guests gathered around as Sophia took the stage, her hands slightly trembling with excitement and nervousness. With a deep breath, she began to play, the melodious tunes filling the room and captivating the audience. The performance was met with enthusiastic applause, and many guests complimented Sophia on her musical skills.

After the performance, Elijah guided some interested visitors to the special display where the harmonica was now securely showcased. He shared the story of the harmonica’s history and its significance to Sophia, careful to maintain the secrecy of its magical attributes as promised. The visitors were fascinated by the tale and appreciated the added personal touch to the art studio’s ambiance.

Meanwhile, Bryce engaged with other guests, explaining the various art techniques used in the displayed works. His detailed explanations and passion for art helped deepen the guests' appreciation and understanding of the artworks.

As the day progressed, the trio noticed a distinct increase in the positivity and creativity within the studio. Artists and visitors alike seemed more inspired and connected, much to Sophia’s delight. The harmonica’s presence, now known to a few, had indeed brought a new energy to the space.

Feeling grateful for the successful event and the support of her friends, Sophia proposed they celebrate their efforts. The trio decided to go out for a well-deserved dinner, reflecting on the day’s successes and planning for future projects.

Over dinner, they discussed how they could continue to enhance the art studio, perhaps by hosting more events or introducing creative workshops. The possibilities seemed endless, and with their combined creativity and teamwork, they felt ready to tackle any challenge that came their way.

As they left the restaurant, the cool evening air was refreshing, and the city lights twinkled brightly. They walked together, their laughter echoing in the night, a testament to their strengthened friendship and shared"
