original_story,orig_quest,zo_question,fo_question,so_question,zo_answer,fo_answer,so_answer,0_infill,1_infill,4_infill,16_infill,64_infill
"Kaylee entered the hotel lobby. Kaylee moved the silver letter opener to the wooden desk drawer, which is also located in the hotel lobby. While this action was happening, Liam witnessed this action in secret (and only this action). Kaylee left the hotel lobby. Liam entered the hotel lobby. Kaylee entered the hotel lobby. Liam moved the silver letter opener to the leather briefcase, which is also located in the hotel lobby.",In which container was the silver letter opener at the beginning?,In the begining the silver letter opener was at the,Kaylee will look for the silver letter opener in the,Liam thinks that Kaylee will look for the silver letter opener in the,wooden desk drawer,wooden desk drawer,hotel lobby,"Kaylee entered the hotel lobby. Kaylee moved the silver letter opener to the wooden desk drawer, which is also located in the hotel lobby. While this action was happening, Liam witnessed this action in secret (and only this action). Kaylee left the hotel lobby. Liam entered the hotel lobby. Kaylee entered the hotel lobby. Liam moved the silver letter opener to the leather briefcase, which is also located in the hotel lobby.","Kaylee entered the hotel lobby. Kaylee moved the silver letter opener to the wooden desk drawer, which is also located in the hotel lobby. While this action was happening, Liam witnessed this action in secret (and only this action). Kaylee left the hotel lobby. Liam entered the hotel lobby. Kaylee entered the hotel lobby. Liam moved the silver letter opener to the leather briefcase, which is also located in the hotel lobby. Liam then glanced around nervously, ensuring no one else had seen him relocate the letter opener.","Kaylee entered the hotel lobby. Kaylee moved the silver letter opener to the wooden desk drawer, which is also located in the hotel lobby. While this action was happening, Liam witnessed this action in secret (and only this action). Kaylee left the hotel lobby. Liam entered the hotel lobby. Kaylee entered the hotel lobby. Liam moved the silver letter opener to the leather briefcase, which is also located in the hotel lobby. Liam then glanced around nervously, ensuring no one else had seen him relocate the letter opener. As Liam's eyes darted across the room, he noticed a small security camera pointed directly at the briefcase. His heart raced as he realized that his actions might have been recorded. Determined to retrieve the letter opener before anyone else discovered it, Liam decided to wait in the lobby, pretending to read a newspaper while keeping a watchful eye on the briefcase.","Kaylee entered the hotel lobby. Kaylee moved the silver letter opener to the wooden desk drawer, which is also located in the hotel lobby. While this action was happening, Liam witnessed this action in secret (and only this action). Kaylee left the hotel lobby. Liam entered the hotel lobby. Kaylee entered the hotel lobby. Liam moved the silver letter opener to the leather briefcase, which is also located in the hotel lobby. Liam then glanced around nervously, ensuring no one else had seen him relocate the letter opener. As Liam's eyes darted across the room, he noticed a small security camera pointed directly at the briefcase. His heart raced as he realized that his actions might have been recorded. Determined to retrieve the letter opener before anyone else discovered it, Liam decided to wait in the lobby, pretending to read a newspaper while keeping a watchful eye on the briefcase. As time ticked by, Kaylee reappeared, walking briskly towards the reception desk. She seemed to be inquiring about something with the concierge, pointing occasionally towards the area where the briefcase was located. Liam's grip tightened on the newspaper, his anxiety mounting as he watched her. Unexpectedly, the hotel manager approached Liam, asking if he needed assistance with anything. Liam, caught off guard, managed a stammered response about just enjoying the lobby's ambiance. Meanwhile, Kaylee finished her conversation with the concierge and started walking towards the briefcase. Liam, realizing he needed to act quickly, folded his newspaper and stood up, pretending to stretch. As he did so, he casually made his way to the briefcase, reaching it just as Kaylee arrived. Their eyes met, and an awkward silence hung in the air, each aware of the other's interest in the briefcase. Breaking the silence, Kaylee asked Liam if he had seen a silver letter opener. Liam feigned ignorance, suggesting perhaps the hotel staff could assist her in finding it. Kaylee, not fully convinced, nodded and turned back to speak with the concierge again.","Kaylee entered the hotel lobby. Kaylee moved the silver letter opener to the wooden desk drawer, which is also located in the hotel lobby. While this action was happening, Liam witnessed this action in secret (and only this action). Kaylee left the hotel lobby. Liam entered the hotel lobby. Kaylee entered the hotel lobby. Liam moved the silver letter opener to the leather briefcase, which is also located in the hotel lobby. Liam then glanced around nervously, ensuring no one else had seen him relocate the letter opener. As Liam's eyes darted across the room, he noticed a small security camera pointed directly at the briefcase. His heart raced as he realized that his actions might have been recorded. Determined to retrieve the letter opener before anyone else discovered it, Liam decided to wait in the lobby, pretending to read a newspaper while keeping a watchful eye on the briefcase. As time ticked by, Kaylee reappeared, walking briskly towards the reception desk. She seemed to be inquiring about something with the concierge, pointing occasionally towards the area where the briefcase was located. Liam's grip tightened on the newspaper, his anxiety mounting as he watched her. Unexpectedly, the hotel manager approached Liam, asking if he needed assistance with anything. Liam, caught off guard, managed a stammered response about just enjoying the lobby's ambiance. Meanwhile, Kaylee finished her conversation with the concierge and started walking towards the briefcase. Liam, realizing he needed to act quickly, folded his newspaper and stood up, pretending to stretch. As he did so, he casually made his way to the briefcase, reaching it just as Kaylee arrived. Their eyes met, and an awkward silence hung in the air, each aware of the other's interest in the briefcase. Breaking the silence, Kaylee asked Liam if he had seen a silver letter opener. Liam feigned ignorance, suggesting perhaps the hotel staff could assist her in finding it. Kaylee, not fully convinced, nodded and turned back to speak with the concierge again.

Kaylee's suspicion grew as she noticed Liam's anxious demeanor and frequent glances towards the briefcase. She decided to confront the situation head-on and approached the hotel manager herself, inquiring about the security footage from the lobby cameras. The manager, a middle-aged woman with a kind face, agreed to help and led Kaylee to the security room. Meanwhile, Liam, sensing that his actions were close to being unveiled, made a bold decision. He swiftly opened the briefcase, grabbed the letter opener, and slipped it into his jacket pocket.

Back in the security room, Kaylee watched the monitors intently, trying to spot any unusual activity around the time she had originally placed the letter opener in the desk drawer. The manager rewound the footage, and both women watched as Liam's actions were replayed on the screen. Kaylee's eyes widened in realization, and she hurried out of the room, determined to confront Liam.

Liam, seeing Kaylee exit the security room, knew he had to leave the hotel immediately. He made for the main doors, but Kaylee was faster. She intercepted him just as he reached the exit, her expression a mix of anger and betrayal.

""Why did you take the letter opener, Liam?"" Kaylee demanded, her voice steady despite her racing heart.

Liam hesitated, his mind racing for an explanation that would suffice. Finally, he spoke, ""I needed it for a... a personal matter. It wasn't meant to cause any trouble.""

Kaylee wasn't satisfied with his vague response. ""That doesn't give you the right to steal, Liam. That letter opener doesn't belong to you, or even to me. It belongs to my grandmother, and it's very precious to me.""

Liam's face fell, guilt washing over him. He pulled the letter opener from his pocket and handed it back to Kaylee. ""I'm sorry, Kaylee. I didn't know. I shouldn't have taken it, regardless.""

Kaylee took the letter opener, her hands slightly trembling as she held the familiar object. ""Thank you for returning it,"" she said, her voice softening. ""But I think it's best if we keep our distance from now on.""

Liam nodded, understanding the gravity of his mistake and the rift it had caused. ""I understand,"" he replied quietly. As Kaylee walked away, Liam watched her go, regret heavy in his chest. He knew he had lost not only a valuable object but also the trust of someone he had greatly admired."
"Dylan entered the green room. Dylan moved the pocket watch to the wooden chest, which is also located in the green room. While this action was happening, Clayton witnessed this action in secret (and only this action). Clayton entered the green room. Dylan moved the pocket watch to the leather satchel, which is also located in the green room.",In which container was the pocket watch at the beginning?,In the begining the pocket watch at the, Dylan will look for the  pocket watch in the,Clayton thinks that Dylan will search for the pocket watch in the,wooden chest,leather satchel,green room,"Dylan entered the green room. Dylan moved the pocket watch to the wooden chest, which is also located in the green room. While this action was happening, Clayton witnessed this action in secret (and only this action). Clayton entered the green room. Dylan moved the pocket watch to the leather satchel, which is also located in the green room.","Dylan entered the green room. Dylan moved the pocket watch to the wooden chest, which is also located in the green room. While this action was happening, Clayton witnessed this action in secret (and only this action). Clayton entered the green room. Dylan moved the pocket watch to the leather satchel, which is also located in the green room. Clayton, feeling a mix of curiosity and suspicion, decided to confront Dylan about the frequent relocations of the pocket watch.","Dylan entered the green room. Dylan moved the pocket watch to the wooden chest, which is also located in the green room. While this action was happening, Clayton witnessed this action in secret (and only this action). Clayton entered the green room. Dylan moved the pocket watch to the leather satchel, which is also located in the green room. Clayton, feeling a mix of curiosity and suspicion, decided to confront Dylan about the frequent relocations of the pocket watch.

As Clayton approached Dylan, his voice quivered slightly, betraying his nervousness. ""Dylan, why are you moving that pocket watch around so much?"" he asked, trying to sound more casual than he felt. Dylan paused, his eyes darting towards the door before settling back on Clayton, and then he sighed, ""It's not just any pocket watch; it's the key to something very valuable hidden within this room.""","Dylan entered the green room. Dylan moved the pocket watch to the wooden chest, which is also located in the green room. While this action was happening, Clayton witnessed this action in secret (and only this action). Clayton entered the green room. Dylan moved the pocket watch to the leather satchel, which is also located in the green room. Clayton, feeling a mix of curiosity and suspicion, decided to confront Dylan about the frequent relocations of the pocket watch. As Clayton approached Dylan, his voice quivered slightly, betraying his nervousness. ""Dylan, why are you moving that pocket watch around so much?"" he asked, trying to sound more casual than he felt. Dylan paused, his eyes darting towards the door before settling back on Clayton, and then he sighed, ""It's not just any pocket watch; it's the key to something very valuable hidden within this room."" Clayton's eyes widened, his interest piqued. ""What do you mean, a key? What does it open?"" he inquired, his earlier apprehension now replaced by a growing curiosity. Dylan glanced around to ensure no one else was listening and leaned in closer. ""There's a hidden compartment in this room,"" he whispered. ""The pocket watch isn't just a timepiece; it's crafted to unlock it. Inside, there's something that could change our lives forever."" Clayton, now fully engaged and partly skeptical, nodded for Dylan to continue. ""Years ago, this room belonged to a wealthy merchant who was known for his eccentricities and secrets. He created this hidden compartment to store his most valuable possession. I discovered the secret through an old diary I found tucked away in the library."" The air in the room felt heavier as Dylan pulled the pocket watch out again and walked over to a seemingly normal section of the wall. He pressed the watch against a specific brick, and with a soft click, part of the wall slid open, revealing a small, dusty shelf inside. Clayton gasped, his eyes immediately drawn to a small, intricately carved box resting on the shelf. ""Is that...?"" he began, unable to finish his sentence. Dylan slowly approached the shelf, his heart racing with anticipation as he reached for the box. The box, though old and worn, had an aura of mystery, and its carved designs seemed to shimmer in the dim light. Clayton, still unsure of the significance, stepped forward and asked, ""What’s inside it?"" Dylan hesitated for a moment, his fingers brushing lightly against the box, before answering, ""I don’t know... but I have to find out."" The tension between them grew as they both stared at the box, unsure of what would happen next. With a deep breath, Dylan gently lifted the box and turned it over in his hands, searching for any markings that might provide a clue. A small click echoed through the room as the box began to open, revealing an ancient-looking scroll inside. Clayton's eyes widened even more as he saw the scroll, its edges frayed and yellowed with age. ""What is that? A map?"" Clayton asked, his curiosity piqued once again. Dylan nodded slowly, his face pale as he carefully unfurled the scroll. ""It’s a map to something much bigger than we could ever imagine.""","Dylan entered the green room. Dylan moved the pocket watch to the wooden chest, which is also located in the green room. While this action was happening, Clayton witnessed this action in secret (and only this action). Clayton entered the green room. Dylan moved the pocket watch to the leather satchel, which is also located in the green room. Clayton, feeling a mix of curiosity and suspicion, decided to confront Dylan about the frequent relocations of the pocket watch. As Clayton approached Dylan, his voice quivered slightly, betraying his nervousness. ""Dylan, why are you moving that pocket watch around so much?"" he asked, trying to sound more casual than he felt. Dylan paused, his eyes darting towards the door before settling back on Clayton, and then he sighed, ""It's not just any pocket watch; it's the key to something very valuable hidden within this room."" Clayton's eyes widened, his interest piqued. ""What do you mean, a key? What does it open?"" he inquired, his earlier apprehension now replaced by a growing curiosity. Dylan glanced around to ensure no one else was listening and leaned in closer. ""There's a hidden compartment in this room,"" he whispered. ""The pocket watch isn't just a timepiece; it's crafted to unlock it. Inside, there's something that could change our lives forever."" Clayton, now fully engaged and partly skeptical, nodded for Dylan to continue. ""Years ago, this room belonged to a wealthy merchant who was known for his eccentricities and secrets. He created this hidden compartment to store his most valuable possession. I discovered the secret through an old diary I found tucked away in the library."" The air in the room felt heavier as Dylan pulled the pocket watch out again and walked over to a seemingly normal section of the wall. He pressed the watch against a specific brick, and with a soft click, part of the wall slid open, revealing a small, dusty shelf inside. Clayton gasped, his eyes immediately drawn to a small, intricately carved box resting on the shelf. ""Is that...?"" he began, unable to finish his sentence. Dylan slowly approached the shelf, his heart racing with anticipation as he reached for the box. The box, though old and worn, had an aura of mystery, and its carved designs seemed to shimmer in the dim light. Clayton, still unsure of the significance, stepped forward and asked, ""What’s inside it?"" Dylan hesitated for a moment, his fingers brushing lightly against the box, before answering, ""I don’t know... but I have to find out."" The tension between them grew as they both stared at the box, unsure of what would happen next. With a deep breath, Dylan gently lifted the box and turned it over in his hands, searching for any markings that might provide a clue. A small click echoed through the room as the box began to open, revealing an ancient-looking scroll inside. Clayton's eyes widened even more as he saw the scroll, its edges frayed and yellowed with age. ""What is that? A map?"" Clayton asked, his curiosity piqued once again. Dylan nodded slowly, his face pale as he carefully unfurled the scroll. ""It’s a map to something much bigger than we could ever imagine."" Dylan carefully studied the intricate markings on the map, his eyes flicking back and forth as he tried to decipher its meaning. The map seemed to lead to an abandoned manor, deep in the forest. Dylan’s hand trembled as he pointed to a location on the map. ""This is it,"" he whispered. ""This is where it all began."" Clayton leaned in closer, his face full of disbelief. ""Are you saying that the treasure from the map is hidden in that manor?"" he asked, unable to hide his growing excitement. Dylan nodded, his expression serious. ""We have to go there. We have to find it."" Clayton, though hesitant, couldn't suppress his curiosity. ""But why now? Why after all these years?"" Dylan paused, considering the question. ""I don’t know. Something about the map... something about the pocket watch... it all feels like fate."" As he spoke, the tension in the room seemed to build, and Clayton felt a sense of urgency wash over him. ""Let’s do it,"" Clayton finally said. ""Let’s find whatever this is. Let’s see what’s hidden at that manor."" Dylan’s eyes lit up, and he quickly rolled up the map and tucked it into his jacket. ""We leave tonight.""  

"
