original_story,orig_quest,zo_question,fo_question,so_question,zo_answer,fo_answer,so_answer,0_infill,1_infill,4_infill,16_infill,64_infill
"Hailey told privately to Kennedy about the artist hospitality arrangements. Landon entered the artist's green room. Landon told privately to Kennedy that Landon is in the artist's green room. Landon told privately to Hailey that Landon is in the artist's green room. While this action was happening, Kennedy witnessed this action in secret (and only this action). Landon moved the portable led lantern to the duffel bag, which is also located in the artist's green room. Kennedy entered the artist's green room. Landon told out loud that the portable led lantern is in the duffel bag. Landon moved the portable led lantern to the backstage production office, leaving the duffel bag in its original location.",In which container was the portable led lantern at the beginning?,In the begining the portable led lantern in the,Landon will look for the  portable led lantern in the,Kennedy thinks that Elijah will search for the portable led lantern in the,duffel bag,backstage production office,duffel bag,"Hailey told privately to Kennedy about the artist hospitality arrangements. Landon entered the artist's green room. Landon told privately to Kennedy that Landon is in the artist's green room. Landon told privately to Hailey that Landon is in the artist's green room. While this action was happening, Kennedy witnessed this action in secret (and only this action). Landon moved the portable led lantern to the duffel bag, which is also located in the artist's green room. Kennedy entered the artist's green room. Landon told out loud that the portable led lantern is in the duffel bag. Landon moved the portable led lantern to the backstage production office, leaving the duffel bag in its original location.","Hailey told privately to Kennedy about the artist hospitality arrangements. Landon entered the artist's green room. Landon told privately to Kennedy that Landon is in the artist's green room. Landon told privately to Hailey that Landon is in the artist's green room. While this action was happening, Kennedy witnessed this action in secret (and only this action). Landon moved the portable led lantern to the duffel bag, which is also located in the artist's green room. Kennedy entered the artist's green room. Landon told out loud that the portable led lantern is in the duffel bag. Landon moved the portable led lantern to the backstage production office, leaving the duffel bag in its original location. Kennedy, curious about the frequent movements of the lantern, decided to follow Landon to the backstage production office to observe further.","Hailey told privately to Kennedy about the artist hospitality arrangements. Landon entered the artist's green room. Landon told privately to Kennedy that Landon is in the artist's green room. Landon told privately to Hailey that Landon is in the artist's green room. While this action was happening, Kennedy witnessed this action in secret (and only this action). Landon moved the portable led lantern to the duffel bag, which is also located in the artist's green room. Kennedy entered the artist's green room. Landon told out loud that the portable led lantern is in the duffel bag. Landon moved the portable led lantern to the backstage production office, leaving the duffel bag in its original location. Kennedy, curious about the frequent movements of the lantern, decided to follow Landon to the backstage production office to observe further.

Once there, Kennedy carefully watched as Landon placed the lantern on a desk next to several stage diagrams and production schedules. Kennedy then quietly approached Landon, asking him directly why he was moving the lantern around so much. Landon, caught off guard by Kennedy's sudden interrogation, admitted that he was trying to ensure the lantern was fully charged and accessible for the upcoming performance, as it was crucial for one of the special effects planned.","Hailey told privately to Kennedy about the artist hospitality arrangements. Landon entered the artist's green room. Landon told privately to Kennedy that Landon is in the artist's green room. Landon told privately to Hailey that Landon is in the artist's green room. While this action was happening, Kennedy witnessed this action in secret (and only this action). Landon moved the portable led lantern to the duffel bag, which is also located in the artist's green room. Kennedy entered the artist's green room. Landon told out loud that the portable led lantern is in the duffel bag. Landon moved the portable led lantern to the backstage production office, leaving the duffel bag in its original location. Kennedy, curious about the frequent movements of the lantern, decided to follow Landon to the backstage production office to observe further. Once there, Kennedy carefully watched as Landon placed the lantern on a desk next to several stage diagrams and production schedules. Kennedy then quietly approached Landon, asking him directly why he was moving the lantern around so much. Landon, caught off guard by Kennedy's sudden interrogation, admitted that he was trying to ensure the lantern was fully charged and accessible for the upcoming performance, as it was crucial for one of the special effects planned. Kennedy nodded in understanding but noticed that Hailey was entering the backstage production office unexpectedly. Hailey, looking slightly concerned, asked if everything was ready for the evening's event. Landon reassured her, pointing to the lantern and explaining its importance to Kennedy. Hailey, satisfied with the explanation, reminded them that time was running short and that they needed to finalize all preparations. As Hailey left, Kennedy helped Landon test the lantern to ensure it was working correctly. They went through several checks, adjusting the brightness and coverage of the light. Satisfied with their efforts, they decided to place the lantern back in the green room, securely inside the duffel bag, ready for the performance. Later, as the performance started, the lantern played a key role in a dramatic scene, casting eerie shadows across the stage, much to the audience's fascination. The effect was a success, and both Landon and Kennedy watched from the wings, proud of their contribution. After the show, the artist personally thanked Landon and Kennedy for their meticulous attention to detail, emphasizing how the lantern's effect had enhanced the performance. The night concluded with the team gathering to celebrate their success, discussing future plans and improvements for upcoming shows. Kennedy, reflecting on the day’s events, appreciated the complexity and teamwork involved in stage productions, feeling more connected to the whole crew.","Hailey told privately to Kennedy about the artist hospitality arrangements. Landon entered the artist's green room. Landon told privately to Kennedy that Landon is in the artist's green room. Landon told privately to Hailey that Landon is in the artist's green room. While this action was happening, Kennedy witnessed this action in secret (and only this action). Landon moved the portable led lantern to the duffel bag, which is also located in the artist's green room. Kennedy entered the artist's green room. Landon told out loud that the portable led lantern is in the duffel bag. Landon moved the portable led lantern to the backstage production office, leaving the duffel bag in its original location. Kennedy, curious about the frequent movements of the lantern, decided to follow Landon to the backstage production office to observe further. Once there, Kennedy carefully watched as Landon placed the lantern on a desk next to several stage diagrams and production schedules. Kennedy then quietly approached Landon, asking him directly why he was moving the lantern around so much. Landon, caught off guard by Kennedy's sudden interrogation, admitted that he was trying to ensure the lantern was fully charged and accessible for the upcoming performance, as it was crucial for one of the special effects planned. Kennedy nodded in understanding but noticed that Hailey was entering the backstage production office unexpectedly. Hailey, looking slightly concerned, asked if everything was ready for the evening's event. Landon reassured her, pointing to the lantern and explaining its importance to Kennedy. Hailey, satisfied with the explanation, reminded them that time was running short and that they needed to finalize all preparations. As Hailey left, Kennedy helped Landon test the lantern to ensure it was working correctly. They went through several checks, adjusting the brightness and coverage of the light. Satisfied with their efforts, they decided to place the lantern back in the green room, securely inside the duffel bag, ready for the performance. Later, as the performance started, the lantern played a key role in a dramatic scene, casting eerie shadows across the stage, much to the audience's fascination. The effect was a success, and both Landon and Kennedy watched from the wings, proud of their contribution. After the show, the artist personally thanked Landon and Kennedy for their meticulous attention to detail, emphasizing how the lantern's effect had enhanced the performance. The night concluded with the team gathering to celebrate their success, discussing future plans and improvements for upcoming shows. Kennedy, reflecting on the day’s events, appreciated the complexity and teamwork involved in stage productions, feeling more connected to the whole crew.

As the celebration continued, discussions turned towards the next projects the team would embark on. Landon, having learned from the day's experiences, suggested implementing a system for better equipment tracking to avoid any last-minute confusions. Kennedy agreed, proposing the use of a digital inventory app that everyone could update in real-time.

Hailey, listening intently, appreciated the initiative and promised to explore budget options for the new system. She also mentioned the possibility of hiring an additional stage manager to help streamline the operations during busy periods. The team nodded in agreement, recognizing the need for more hands-on deck to maintain the quality of their productions.

As the ideas flowed, the artist, intrigued by the discussion, joined in. He expressed his interest in more innovative stage effects and asked if the team could research advanced technologies that could be integrated into future shows. Landon and Kennedy exchanged excited glances, both keen on exploring new technological frontiers.

The evening wrapped up with everyone feeling invigorated and inspired by the collaborative spirit. They agreed to meet again the next week to finalize the new strategies and start implementing the changes. Kennedy, on his way home, couldn't help but feel a deep sense of fulfillment. He realized that his role was not just about managing the technical aspects but also about bringing people together to create something truly magical.

As the days passed, Kennedy took the lead on the technology research. He contacted various tech companies, arranged demos, and even attended a few workshops to better understand the possibilities. Landon, meanwhile, focused on refining the logistical aspects, ensuring that the new inventory system was customizable and user-friendly.

Hailey worked on the administrative end, setting up meetings with potential sponsors who could fund the technological upgrades. She also coordinated with the existing crew to prepare them for the upcoming changes, ensuring everyone was on board and adequately trained.

The artist, excited about the direction the team was taking, began sketching new concepts for his performances, incorporating the potential new effects Kennedy and Landon discussed. His creativity, fueled by the team's support, reached new heights.

By the time their next production rolled around, the team was better equipped than ever. The new systems were in place, the crew was well-coordinated, and the artist's vision was clearer and more spectacular. The performance was a resounding success, with critics and audiences alike praising the innovative use of technology and the seamless execution of the production.

Kennedy, watching from the"
"Leslie entered the main tent. Leslie left the main tent. Isabella entered the storage trailer. Isabella moved the stuffed rabbit to the wooden chest, which is also located in the storage trailer. Leslie entered the main tent. Isabella moved the stuffed rabbit to the main tent, leaving the wooden chest in its original location. Isabella told out loud about the festival marketing strategies. Isabella told privately to Colton that Leslie is in the main tent. While this action was happening, Leslie witnessed this action in secret (and only this action).",In which container was the stuffed rabbit at the beginning?,In the begining the stuffed rabit in the,Isabella will look for the  stuffed rabbitin the ,Isabella thinks that Leslie will search for the stuffed rabbit in the,wooden chest,main tent,main tent,"Leslie entered the main tent. Leslie left the main tent. Isabella entered the storage trailer. Isabella moved the stuffed rabbit to the wooden chest, which is also located in the storage trailer. Leslie entered the main tent. Isabella moved the stuffed rabbit to the main tent, leaving the wooden chest in its original location. Isabella told out loud about the festival marketing strategies. Isabella told privately to Colton that Leslie is in the main tent. While this action was happening, Leslie witnessed this action in secret (and only this action).","Leslie entered the main tent. Leslie left the main tent. Isabella entered the storage trailer. Isabella moved the stuffed rabbit to the wooden chest, which is also located in the storage trailer. Leslie entered the main tent. Isabella moved the stuffed rabbit to the main tent, leaving the wooden chest in its original location. Isabella told out loud about the festival marketing strategies. Isabella told privately to Colton that Leslie is in the main tent. While this action was happening, Leslie witnessed this action in secret (and only this action). Unbeknownst to Isabella, Leslie's hidden presence in the tent had allowed her to overhear the entire private conversation with Colton.","Leslie entered the main tent. Leslie left the main tent. Isabella entered the storage trailer. Isabella moved the stuffed rabbit to the wooden chest, which is also located in the storage trailer. Leslie entered the main tent. Isabella moved the stuffed rabbit to the main tent, leaving the wooden chest in its original location. Isabella told out loud about the festival marketing strategies. Isabella told privately to Colton that Leslie is in the main tent. While this action was happening, Leslie witnessed this action in secret (and only this action). Unbeknownst to Isabella, Leslie's hidden presence in the tent had allowed her to overhear the entire private conversation with Colton. Feeling betrayed by Isabella's disclosure to Colton, Leslie began to question their friendship and trust. As Leslie continued to listen, she gathered critical information about changes in festival management that Isabella hadn't shared with her. Determined to confront the situation, Leslie waited for the right moment to discuss her feelings and the newly discovered plans with Isabella.","Leslie entered the main tent. Leslie left the main tent. Isabella entered the storage trailer. Isabella moved the stuffed rabbit to the wooden chest, which is also located in the storage trailer. Leslie entered the main tent. Isabella moved the stuffed rabbit to the main tent, leaving the wooden chest in its original location. Isabella told out loud about the festival marketing strategies. Isabella told privately to Colton that Leslie is in the main tent. While this action was happening, Leslie witnessed this action in secret (and only this action). Unbeknownst to Isabella, Leslie's hidden presence in the tent had allowed her to overhear the entire private conversation with Colton. Feeling betrayed by Isabella's disclosure to Colton, Leslie began to question their friendship and trust. As Leslie continued to listen, she gathered critical information about changes in festival management that Isabella hadn't shared with her. Determined to confront the situation, Leslie waited for the right moment to discuss her feelings and the newly discovered plans with Isabella. As the festival buzzed with activity around them, Leslie's mind was a tumult of emotions and thoughts. She watched from a corner as Isabella mingled with the guests, laughing and seemingly oblivious to the storm brewing inside Leslie. The weight of the secret she had overheard felt like a heavy cloak around her shoulders. Meanwhile, Colton, unaware of Leslie's knowledge, continued to discuss logistical details with various team members. Leslie’s heart raced as she pondered the implications of the management changes Isabella had discussed with Colton. It meant reassigning roles and possibly even layoffs, things that would affect many of their friends, including her. The sense of betrayal deepened as Leslie realized that Isabella might have been trying to protect her from the inevitable backlash or perhaps exclude her from the decision-making process altogether. The festival continued, a colorful blur to Leslie as she mulled over her next steps. She knew she needed to confront Isabella before the day was over; the festering wound of betrayal would only grow more painful with time. Finally, gathering her courage, Leslie approached Isabella just as the sun began to set, casting long shadows over the bustling festival grounds. Isabella, surprised to see Leslie's serious demeanor, sensed that something was amiss. The confrontation was intense yet hushed, as Leslie expressed her hurt and disbelief over being kept in the dark.","Leslie entered the main tent. Leslie left the main tent. Isabella entered the storage trailer. Isabella moved the stuffed rabbit to the wooden chest, which is also located in the storage trailer. Leslie entered the main tent. Isabella moved the stuffed rabbit to the main tent, leaving the wooden chest in its original location. Isabella told out loud about the festival marketing strategies. Isabella told privately to Colton that Leslie is in the main tent. While this action was happening, Leslie witnessed this action in secret (and only this action). Unbeknownst to Isabella, Leslie's hidden presence in the tent had allowed her to overhear the entire private conversation with Colton. Feeling betrayed by Isabella's disclosure to Colton, Leslie began to question their friendship and trust. As Leslie continued to listen, she gathered critical information about changes in festival management that Isabella hadn't shared with her. Determined to confront the situation, Leslie waited for the right moment to discuss her feelings and the newly discovered plans with Isabella. As the festival buzzed with activity around them, Leslie's mind was a tumult of emotions and thoughts. She watched from a corner as Isabella mingled with the guests, laughing and seemingly oblivious to the storm brewing inside Leslie. The weight of the secret she had overheard felt like a heavy cloak around her shoulders. Meanwhile, Colton, unaware of Leslie's knowledge, continued to discuss logistical details with various team members. Leslie’s heart raced as she pondered the implications of the management changes Isabella had discussed with Colton. It meant reassigning roles and possibly even layoffs, things that would affect many of their friends, including her. The sense of betrayal deepened as Leslie realized that Isabella might have been trying to protect her from the inevitable backlash or perhaps exclude her from the decision-making process altogether. The festival continued, a colorful blur to Leslie as she mulled over her next steps. She knew she needed to confront Isabella before the day was over; the festering wound of betrayal would only grow more painful with time. Finally, gathering her courage, Leslie approached Isabella just as the sun began to set, casting long shadows over the bustling festival grounds. Isabella, surprised to see Leslie's serious demeanor, sensed that something was amiss. The confrontation was intense yet hushed, as Leslie expressed her hurt and disbelief over being kept in the dark.

During their conversation, Isabella’s expression softened as she realized the impact of her actions. She tried to explain her reasons, mentioning the pressure from the festival’s board to make swift decisions. However, Leslie felt that these explanations were insufficient to justify the breach of trust. The air was thick with tension as the festival lights twinkled around them, a stark contrast to the darkening mood between the two friends.

Isabella reached out, touching Leslie’s arm gently, trying to bridge the gap that had formed so suddenly between them. ""I thought I was doing the right thing,"" Isabella confessed, her voice a mixture of regret and uncertainty. Leslie, however, pulled away slightly, still unsure if she could easily forgive the secrecy.

The conversation paused as a group of festival-goers passed by, their laughter echoing in the cool evening air. Once they were alone again, Leslie took a deep breath and asked, ""What now? How do we move forward from this?""

Isabella was silent for a moment, collecting her thoughts. ""I want to be transparent with you from now on,"" she offered earnestly. ""I value our friendship and I am sorry for jeopardizing it.""

Leslie nodded slowly, the decision weighing heavily on her heart. She knew rebuilding trust would take time, but Isabella’s genuine remorse was a step in the right direction. ""We need to redefine our partnership and set clear boundaries,"" Leslie suggested, her tone more composed now.

Isabella agreed, relieved that there was a path forward despite the rocky ground they found themselves on. They spent the next few minutes discussing practical steps they could take to ensure better communication and collaboration in the future.

As the festival’s fireworks began to light up the night sky, Leslie and Isabella watched in silence. The bursts of color reflected in their eyes, mirroring the cautious hope that flickered in their hearts. They knew the road to recovery might be long, but the willingness to mend their friendship was a promising start.

With the festival wrapping up, Leslie and Isabella walked towards the exit together. Though the air was still slightly chilly with unresolved feelings, both felt a bit warmer knowing they were taking steps to heal. As they reached the parking lot, Leslie turned to Isabella, offering a small but sincere smile.

""Let’s try to make the next festival better, together,"" Leslie said, extending an olive branch.

Isabella nodded, her own smile growing. ""Together,"" she echoed, accepting the peace offering.

As they parted ways that evening, the festival’s lights dimmed behind them, signaling the end of the day but perhaps the beginning of a renewed friendship."
