original_story,orig_quest,zo_question,fo_question,so_question,zo_answer,fo_answer,so_answer,0_infill,1_infill,4_infill,16_infill,64_infill
"Kennedy entered the artist's green room. Kennedy told privately to Hailey that Kennedy is in the artist's green room. While this action was happening, Landon witnessed this action in secret (and only this action). Kennedy moved the portable led lantern to the duffel bag, which is also located in the artist's green room. Kennedy left the artist's green room. Hailey entered the artist's green room. Kennedy entered the backstage production office. Hailey told privately to Landon about the weather contingency plans. Landon told privately to Kennedy about the festival crowd control measures.",In which container will Kennedy search for the portable led lantern?,Kennedy will search the portable led lantern in the,Kennedy will look for  the portable led lantern in the,What does Kennedy think about Landon's belief on festival crowd control measures? (knows about it / does not know about it),duffel bag,duffel bag,knows about it,"Kennedy entered the artist's green room. Kennedy told privately to Hailey that Kennedy is in the artist's green room. While this action was happening, Landon witnessed this action in secret (and only this action). Kennedy moved the portable led lantern to the duffel bag, which is also located in the artist's green room. Kennedy left the artist's green room. Hailey entered the artist's green room. Kennedy entered the backstage production office. Hailey told privately to Landon about the weather contingency plans. Landon told privately to Kennedy about the festival crowd control measures.","Kennedy entered the artist's green room. Kennedy told privately to Hailey that Kennedy is in the artist's green room. While this action was happening, Landon witnessed this action in secret (and only this action). Kennedy moved the portable led lantern to the duffel bag, which is also located in the artist's green room. Kennedy left the artist's green room. Hailey entered the artist's green room. Kennedy entered the backstage production office. Hailey told privately to Landon about the weather contingency plans. Landon told privately to Kennedy about the festival crowd control measures. Meanwhile, Hailey, intrigued by the duffel bag's contents, subtly inspected it while she was in the green room.","Kennedy entered the artist's green room. Kennedy told privately to Hailey that Kennedy is in the artist's green room. While this action was happening, Landon witnessed this action in secret (and only this action). Kennedy moved the portable led lantern to the duffel bag, which is also located in the artist's green room. Kennedy left the artist's green room. Hailey entered the artist's green room. Kennedy entered the backstage production office. Hailey told privately to Landon about the weather contingency plans. Landon told privately to Kennedy about the festival crowd control measures. Meanwhile, Hailey, intrigued by the duffel bag's contents, subtly inspected it while she was in the green room.

As Hailey unzipped the duffel bag, she found an assortment of stage costumes and some handwritten notes that seemed to be song lyrics. Curious, she carefully examined the notes and realized they were for a surprise performance planned for the night. Realizing the importance of the surprise, she carefully placed everything back as it was, making sure not to alert anyone to her discovery.","Kennedy entered the artist's green room. Kennedy told privately to Hailey that Kennedy is in the artist's green room. While this action was happening, Landon witnessed this action in secret (and only this action). Kennedy moved the portable led lantern to the duffel bag, which is also located in the artist's green room. Kennedy left the artist's green room. Hailey entered the artist's green room. Kennedy entered the backstage production office. Hailey told privately to Landon about the weather contingency plans. Landon told privately to Kennedy about the festival crowd control measures. Meanwhile, Hailey, intrigued by the duffel bag's contents, subtly inspected it while she was in the green room. As Hailey unzipped the duffel bag, she found an assortment of stage costumes and some handwritten notes that seemed to be song lyrics. Curious, she carefully examined the notes and realized they were for a surprise performance planned for the night. Realizing the importance of the surprise, she carefully placed everything back as it was, making sure not to alert anyone to her discovery. She then left the green room swiftly, pondering whether to share her findings with Landon or to keep the secret safe until the performance. Back in the production office, Kennedy was reviewing the final details for the night's event. Unaware of Hailey's discovery, Kennedy felt a slight unease, unsure if moving the lantern had been noticed by anyone. Meanwhile, Landon, deep in thought about the crowd control measures, decided to check the green room himself, suspecting that something was amiss. As Landon entered the green room, he noticed the duffel bag slightly ajar but saw nothing amiss at a glance. He then made a mental note to keep an extra eye on the backstage activities, especially concerning the mysterious duffel bag. On his way out, he bumped into Hailey, who appeared slightly flustered. Landon, sensing her discomfort, decided to gently probe her about her recent visit to the green room. Hailey, caught off-guard, managed to divert the conversation towards the upcoming weather changes and how they might affect the evening's schedule. Landon, though slightly suspicious, chose to focus on the immediate concerns of potential rain and crowd safety. The duo then proceeded to discuss various aspects of emergency management, all the while Hailey hoped her discovery would remain undiscovered until it was revealed on stage. As the evening progressed, the tension backstage increased with every passing hour.","Kennedy entered the artist's green room. Kennedy told privately to Hailey that Kennedy is in the artist's green room. While this action was happening, Landon witnessed this action in secret (and only this action). Kennedy moved the portable LED lantern to the duffel bag, which is also located in the artist's green room. Kennedy left the artist's green room. Hailey entered the artist's green room. Kennedy entered the backstage production office. Hailey told privately to Landon about the weather contingency plans. Landon told privately to Kennedy about the festival crowd control measures. Meanwhile, Hailey, intrigued by the duffel bag's contents, subtly inspected it while she was in the green room. As Hailey unzipped the duffel bag, she found an assortment of stage costumes and some handwritten notes that seemed to be song lyrics. Curious, she carefully examined the notes and realized they were for a surprise performance planned for the night. Realizing the importance of the surprise, she carefully placed everything back as it was, making sure not to alert anyone to her discovery. She then left the green room swiftly, pondering whether to share her findings with Landon or to keep the secret safe until the performance. Back in the production office, Kennedy was reviewing the final details for the night's event. Unaware of Hailey's discovery, Kennedy felt a slight unease, unsure if moving the lantern had been noticed by anyone. Meanwhile, Landon, deep in thought about the crowd control measures, decided to check the green room himself, suspecting that something was amiss. As Landon entered the green room, he noticed the duffel bag slightly ajar but saw nothing amiss at a glance. He then made a mental note to keep an extra eye on the backstage activities, especially concerning the mysterious duffel bag. On his way out, he bumped into Hailey, who appeared slightly flustered. Landon, sensing her discomfort, decided to gently probe her about her recent visit to the green room. Hailey, caught off-guard, managed to divert the conversation towards the upcoming weather changes and how they might affect the evening's schedule. Landon, though slightly suspicious, chose to focus on the immediate concerns of potential rain and crowd safety. The duo then proceeded to discuss various aspects of emergency management, all the while Hailey hoped her discovery would remain undiscovered until it was revealed on stage. As the evening progressed, the tension backstage increased with every passing hour.  Backstage, the staff was running through the final preparations for the event. The performers were getting ready, and the crew was busy checking equipment. Kennedy, who had been dealing with a series of logistical issues, couldn't shake the feeling that something wasn't quite right. He couldn't put his finger on it but felt that the pressure was mounting. Meanwhile, Hailey sat quietly in a corner, her mind racing over what she had uncovered. The surprise performance was set to be the highlight of the evening, and she couldn't help but feel both excited and nervous about it. She knew it was a secret, but the temptation to share it with Landon was strong. After all, they had been working together for months, and Hailey trusted him. Still, something told her that revealing the surprise early could ruin the magic of the moment.  As the clock ticked closer to showtime, Kennedy's unease grew. He walked over to the production monitor, watching the countdown to the event. The entire venue seemed to be buzzing with anticipation, but Kennedy couldn’t ignore the gnawing feeling in his gut. He thought back to the earlier moments in the green room, where the lantern had been moved. Was it possible someone had seen him? Had he been too careless? He shook his head, trying to focus. It was just nerves—he had to stay sharp.  Landon, having checked the crowd control measures once again, joined Kennedy in the production office. ""How’s everything looking?"" Landon asked, noticing the tension in Kennedy’s posture. Kennedy gave a brief nod, still staring at the monitor. ""It’s all coming together. Just a lot on my mind, I guess,"" he replied. Landon glanced over at the monitor. ""You did a good job organizing this, Kennedy. Everything’s looking good.""  Despite Landon’s words of reassurance, Kennedy couldn't shake the feeling that something had slipped through the cracks. He excused himself to make one more round through the venue. As Kennedy left, Landon stayed behind, tapping a pen on the desk, still thinking about Hailey’s strange reaction earlier. He hadn’t pressed her too much about the green room, but something didn’t sit right. He’d been working with her for too long not to notice when she was hiding something.  Meanwhile, Hailey was back in the green room, staring at the duffel bag once again. She had to know more, but she also knew that if she got too involved, she could jeopardize the entire event. She decided to take a step back, but not before making sure everything was in place. Her fingers brushed over the costumes, making sure they were arranged just as they had been. She couldn’t afford any slip-ups.  As the final preparations were underway, the crew began to take their positions. The performers were in the wings, ready for their surprise appearance. Kennedy, still uneasy, glanced at his watch, his thoughts racing. The tension was thick, but the night was about to begin. Backstage, the final moments of preparation were winding down. Everything was in place, but Hailey couldn’t shake the feeling that the surprise performance would change everything. With a deep breath, she reminded herself to stay calm—everything was set, and it was too late to back out now. The lights dimmed, and the crowd roared in anticipation as the show began.  "
"Victoria told privately to Harper about the customer feedback and complaints. Harper entered the main game store floor. Harper told privately to Victoria that Harper is in the main game store floor. While this action was happening, Gavin witnessed this action in secret (and only this action). Harper left the main game store floor. Victoria told privately to Gavin that Harper is in the main game store floor. Harper entered the back room of the game store. Gavin told privately to Harper about the store layout and organization. Harper moved the collectible miniature figurine to the plastic storage bin, which is also located in the back room of the game store.",In which container will Harper search for the collectible miniature figurine?,Harper will search for the collectible miniature figurine in the,Harper will look for the collectible miniature figurine in the,What does Victoria think about Harper's belief on store layout and organization? (knows about it / does not know about it),plastic storage bin,plastic storage bin,does not know about it,"Victoria told privately to Harper about the customer feedback and complaints. Harper entered the main game store floor. Harper told privately to Victoria that Harper is in the main game store floor. While this action was happening, Gavin witnessed this action in secret (and only this action). Harper left the main game store floor. Victoria told privately to Gavin that Harper is in the main game store floor. Harper entered the back room of the game store. Gavin told privately to Harper about the store layout and organization. Harper moved the collectible miniature figurine to the plastic storage bin, which is also located in the back room of the game store.","Victoria told privately to Harper about the customer feedback and complaints. Harper entered the main game store floor. Harper told privately to Victoria that Harper is in the main game store floor. While this action was happening, Gavin witnessed this action in secret (and only this action). Harper left the main game store floor. Victoria told privately to Gavin that Harper is in the main game store floor. Harper entered the back room of the game store. Gavin told privately to Harper about the store layout and organization. Harper moved the collectible miniature figurine to the plastic storage bin, which is also located in the back room of the game store. Victoria, noticing the shift in the organization of the back room, decided to implement new inventory tracking measures.","Victoria told privately to Harper about the customer feedback and complaints. Harper entered the main game store floor. Harper told privately to Victoria that Harper is in the main game store floor. While this action was happening, Gavin witnessed this action in secret (and only this action). Harper left the main game store floor. Victoria told privately to Gavin that Harper is in the main game store floor. Harper entered the back room of the game store. Gavin told privately to Harper about the store layout and organization. Harper moved the collectible miniature figurine to the plastic storage bin, which is also located in the back room of the game store. Victoria, noticing the shift in the organization of the back room, decided to implement new inventory tracking measures. She introduced a digital system that would automatically update the inventory list whenever items were moved or sold. Additionally, Victoria assigned specific team members to monitor these updates regularly, ensuring that all changes were accurately recorded. This new system would help in maintaining a streamlined process and avoid any future discrepancies that could occur with manual tracking.","Victoria told privately to Harper about the customer feedback and complaints. Harper entered the main game store floor. Harper told privately to Victoria that Harper is in the main game store floor. While this action was happening, Gavin witnessed this action in secret (and only this action). Harper left the main game store floor. Victoria told privately to Gavin that Harper is in the main game store floor. Harper entered the back room of the game store. Gavin told privately to Harper about the store layout and organization. Harper moved the collectible miniature figurine to the plastic storage bin, which is also located in the back room of the game store. Victoria, noticing the shift in the organization of the back room, decided to implement new inventory tracking measures. She introduced a digital system that would automatically update the inventory list whenever items were moved or sold. Additionally, Victoria assigned specific team members to monitor these updates regularly, ensuring that all changes were accurately recorded. This new system would help in maintaining a streamlined process and avoid any future discrepancies that could occur with manual tracking. To further enhance the system, Victoria scheduled training sessions for all employees to familiarize them with the new digital tracking tools. Harper, feeling responsible for the initial confusion that led to the change, volunteered to lead the training sessions. During the first session, Harper demonstrated how to properly log items in and out of the inventory using the digital system. Gavin, meanwhile, took the initiative to reorganize the back room, ensuring that every item had a specific place and was clearly labeled. As the weeks passed, the new system proved to be effective. Inventory discrepancies decreased significantly, and the staff felt more confident in managing the store’s products. Harper noticed that customers were also responding positively; they appreciated the efficiency with which the staff could locate and provide products. Seeing the success of these changes, Victoria planned to expand the digital tracking to other parts of the store, starting with the electronics section. One day, while Harper was updating the system with new shipments that had arrived, Gavin approached with a suggestion. He proposed the integration of QR codes on each product label that could be scanned for instant access to product information and location within the store. Victoria loved the idea and decided to implement it immediately. With the QR codes in place, the store became even more organized.","Victoria told privately to Harper about the customer feedback and complaints. Harper entered the main game store floor. Harper told privately to Victoria that Harper is in the main game store floor. While this action was happening, Gavin witnessed this action in secret (and only this action). Harper left the main game store floor. Victoria told privately to Gavin that Harper is in the main game store floor. Harper entered the back room of the game store. Gavin told privately to Harper about the store layout and organization. Harper moved the collectible miniature figurine to the plastic storage bin, which is also located in the back room of the game store. Victoria, noticing the shift in the organization of the back room, decided to implement new inventory tracking measures. She introduced a digital system that would automatically update the inventory list whenever items were moved or sold. Additionally, Victoria assigned specific team members to monitor these updates regularly, ensuring that all changes were accurately recorded. This new system would help in maintaining a streamlined process and avoid any future discrepancies that could occur with manual tracking. To further enhance the system, Victoria scheduled training sessions for all employees to familiarize them with the new digital tracking tools. Harper, feeling responsible for the initial confusion that led to the change, volunteered to lead the training sessions. During the first session, Harper demonstrated how to properly log items in and out of the inventory using the digital system. Gavin, meanwhile, took the initiative to reorganize the back room, ensuring that every item had a specific place and was clearly labeled. As the weeks passed, the new system proved to be effective. Inventory discrepancies decreased significantly, and the staff felt more confident in managing the store’s products. Harper noticed that customers were also responding positively; they appreciated the efficiency with which the staff could locate and provide products. Seeing the success of these changes, Victoria planned to expand the digital tracking to other parts of the store, starting with the electronics section. One day, while Harper was updating the system with new shipments that had arrived, Gavin approached with a suggestion. He proposed the integration of QR codes on each product label that could be scanned for instant access to product information and location within the store. Victoria loved the idea and decided to implement it immediately. With the QR codes in place, the store became even more organized.

The implementation of QR codes transformed the shopping experience. Customers could now simply scan a code and receive detailed information about the product, including reviews, price comparisons, and stock availability in real-time. This feature not only enhanced customer satisfaction but also significantly reduced the workload on the staff, who were previously tasked with answering numerous queries about products.

Furthermore, Victoria noticed an increase in sales due to the ease of access to information, which helped customers make quicker and more informed decisions. The staff also benefited from the QR codes, as it allowed them more time to focus on other important tasks, like restocking shelves and managing in-store promotions.

To capitalize on these improvements, Victoria launched a marketing campaign highlighting the new digital enhancements. The campaign featured customer testimonials and interactive ads demonstrating the convenience of using the QR codes. This attracted even more customers to the store, boosting its reputation as a cutting-edge retailer in the gaming and electronics industry.

Meanwhile, Harper, motivated by the successful integration of the digital tracking system and QR codes, proposed the idea of online reservations for highly sought-after items. Victoria embraced this idea, seeing it as another opportunity to improve service and manage inventory more effectively.

The online reservation system allowed customers to reserve items before arriving at the store, ensuring they would not leave disappointed. It also helped the store manage its inventory better by predicting demand for popular items and adjusting their stock accordingly.

As the store continued to evolve, Victoria, Harper, and Gavin formed a strong team, frequently brainstorming new ideas to enhance customer experience and streamline operations. Their collaborative efforts led to several innovative initiatives, including virtual reality demonstrations for high-end electronics, which allowed customers to experience products before purchasing them.

Victoria’s game store soon became a community hub, known not just for its products but also for its forward-thinking approach to retail. The trio's dedication to improving every aspect of the store ensured that customers left satisfied and often returned, bringing new patrons with them. The store's success was a testament to the power of innovation and teamwork in transforming a traditional retail environment into a dynamic and customer-friendly space.
"
